<?xml version="1.0" encoding="UTF-8"?>
<!DOCTYPE clasificacion
        SYSTEM "clasificacion.dtd"
        >
<clasificacion>
    <equipo id="01" >
        <nombre></nombre>
        <puntos></puntos>
    </equipo>

    <equipo id="02">
        <nombre></nombre>
        <puntos></puntos>
    </equipo>

    <equipo id="03">
        <nombre></nombre>
        <puntos></puntos>
    </equipo>

</clasificacion>